{
  "$schema": "https://milxdy.local/schemas/local-app-package.schema.json",
  "manifestVersion": 1,
  "id": "pets-maker",
  "name": "Pets Maker",
  "version": "0.1.2-pilot",
  "description": "An optional catalog-installed side-rail app for preparing validated Remilia Maker pet-request bundles.",
  "packageKind": "app",
  "sdk": {
    "minVersion": "0.2.4",
    "targetVersion": "0.2.4",
    "notes": ["Uses only the public overlay app lifecycle, local assets, diagnostics, and cancellation contract."]
  },
  "contentEntry": "dist/content.js",
  "css": [
    { "id": "pets-maker.theme", "path": "styles/theme.css" },
    { "id": "pets-maker.overlay", "path": "styles/overlay.css" },
    { "id": "pets-maker.form", "path": "styles/maker.css" }
  ],
  "dock": {
    "label": "Pets",
    "icon": "assets/remy.png",
    "defaultSide": "right"
  },
  "defaultEnabled": false,
  "storageKeys": {
    "local": ["milxdy.local.pets-maker.enabled"]
  },
  "settings": [
    {
      "id": "pets-maker.enabled",
      "label": "Pets Maker",
      "description": "Enable the optional Remilia pet bundle maker and its side-rail launcher.",
      "scope": "app",
      "location": "appsAndFeatures",
      "role": "enablement",
      "storage": { "area": "local", "key": "milxdy.local.pets-maker.enabled" },
      "defaultValue": false,
      "control": { "type": "toggle" },
      "reset": { "behavior": "restoreDefault" },
      "presets": ["firstRun"]
    }
  ],
  "surfaces": ["overlayApp"],
  "lifecycle": {
    "mode": "runtime",
    "localOnly": true,
    "notes": ["Loads on dockOpen and removes all app-owned DOM and listeners on close, disable, abort, or dispose."]
  },
  "siteScopes": [
    {
      "site": "x",
      "hosts": ["https://x.com/*", "https://twitter.com/*"],
      "integration": "overlayApp",
      "surfaces": ["overlayApp"],
      "presentation": "sideRailOverlay",
      "notes": ["Uses the shared X/Twitter App SDK runtime and adds no X/Twitter host permission."]
    },
    {
      "site": "remiliaNet",
      "hosts": ["https://maker.remilia.org/*"],
      "integration": "contentScript",
      "surfaces": ["overlayApp"],
      "presentation": "userAction",
      "notes": ["After an explicit Fetch click, reads only public NFT metadata for the selected Maker family and number; the app does not mount a UI on the Maker site."]
    }
  ],
  "permissions": {
    "hosts": ["https://maker.remilia.org/*"]
  },
  "cost": {
    "startup": "cheap",
    "perSurface": "moderate",
    "network": "batched",
    "worker": "none",
    "domWrite": "moderate"
  },
  "loadTriggers": ["dockOpen"],
  "chrome": {
    "nativeStyle": "reminet",
    "supportedStyles": ["native", "classic", "reminet"],
    "notes": ["Uses package-owned Remilia pet-lab chrome aligned with the public RemiNet window style and SDK semantic tokens."]
  },
  "hub": {
    "category": "media",
    "shortDescription": "Build a local Maker avatar bundle for the Remilia pet pipeline.",
    "longDescription": "Choose a Maker family and NFT number, provide the local transparent avatar and exact traits, complete the lower body, preview the deterministic composite, and download a validated bundle.",
    "rail": { "supported": true, "defaultPinned": true },
    "presets": ["full"],
    "permissionNotes": ["The https://maker.remilia.org/* host permission is used only after an explicit Fetch click to read public metadata for the selected family and NFT number."],
    "dataNotes": ["Reads only the PNG selected in the visible app form and processes it in memory for preview and download.", "An explicit Fetch sends only the selected public Maker family and NFT number; returned public traits populate the visible form and are not cached."],
    "remoteServices": ["The official Maker metadata endpoint is queried only after an explicit Fetch click and returns public NFT traits."],
    "localStorageNotes": ["Stores only the generated app enablement toggle."],
    "privacyLabels": ["local-only", "local-files", "remote-api"]
  },
  "privacy": {
    "permissionNotes": ["The https://maker.remilia.org/* host permission is used only after an explicit Fetch click to read public metadata for the selected family and NFT number."],
    "dataNotes": ["The selected PNG and body choices stay in the open app and generated local ZIP; the image is never uploaded.", "An explicit Fetch sends only the selected public Maker family and NFT number to maker.remilia.org and populates the visible trait fields from its public response; returned traits are not cached.", "Nothing is posted or published."],
    "localStorageNotes": ["Stores only app enablement; maker form state and selected files are not persisted."],
    "remoteServices": ["The official Maker metadata endpoint is queried only after an explicit Fetch click and returns public NFT traits."],
    "privacyLabels": ["local-only", "local-files", "remote-api"],
    "consentRequired": true
  },
  "package": {
    "assets": [
      { "id": "pets-maker.remy", "path": "assets/remy.png", "kind": "icon", "webAccessible": true, "sha256": "90e54050cd9eb16c79c14428a56e47ccfa2a6717c8c8a26ed8cf862064eb20fb" },
      { "id": "pets-maker.theme", "path": "styles/theme.css", "kind": "style", "webAccessible": false },
      { "id": "pets-maker.overlay", "path": "styles/overlay.css", "kind": "style", "webAccessible": false },
      { "id": "pets-maker.form", "path": "styles/maker.css", "kind": "style", "webAccessible": false }
    ],
    "webAccessibleAssets": ["assets/remy.png"]
  },
  "review": {
    "status": "reviewed",
    "sourceUrl": "https://github.com/bonklek/milXdy/tree/main/packages/maintainer/pets-maker",
    "reviewedBy": "milxdy-automated-review",
    "reviewedAt": "2026-10-05",
    "notes": ["Reviewed optional App SDK package for the maintainer catalog.", "Remy icon provenance and VPL compatibility are recorded in AUTHORING_LOG.md.", "The package uses no private host imports, background handlers, or page observers; its only remote call is an explicit read of public Maker metadata.", "Local adversarial review covers bounded metadata reads, PNG decode limits, stale selections, and close/disable cancellation."]
  }
}
