{
  "manifestVersion": 1,
  "id": "composerTools",
  "name": "Tweet Composer",
  "version": "0.1.0",
  "description": "Converts typed double dashes to em dashes inside supported X/Twitter post composers.",
  "packageKind": "feature",
  "sdk": {
    "minVersion": "0.2.4",
    "targetVersion": "0.2.4",
    "notes": [
      "Maintainer package candidate adapted without behavior changes from the built-in Composer Tools feature."
    ]
  },
  "contentEntry": "dist/content.js",
  "defaultEnabled": true,
  "storageKeys": {
    "local": [
      "milxdy.composerTools.enabled"
    ]
  },
  "settings": [
    {
      "id": "composerTools.enabled",
      "label": "Composer Tools",
      "description": "Convert double dashes to em dashes while typing supported X/Twitter posts.",
      "scope": "feature",
      "location": "appsAndFeatures",
      "role": "enablement",
      "storage": {
        "area": "local",
        "key": "milxdy.composerTools.enabled"
      },
      "defaultValue": true,
      "control": {
        "type": "toggle"
      },
      "reset": {
        "behavior": "restoreDefault"
      },
      "presets": [
        "firstRun",
        "profilePack"
      ]
    }
  ],
  "surfaces": [],
  "lifecycle": {
    "mode": "runtime",
    "localOnly": true,
    "notes": [
      "Runs as a lightweight document input listener for supported X/Twitter post composer textboxes.",
      "Dispose removes both input listeners and the document loaded marker."
    ]
  },
  "siteScopes": [
    {
      "site": "x",
      "hosts": [
        "https://x.com/*",
        "https://twitter.com/*"
      ],
      "integration": "contentScript",
      "surfaces": [
        "tweet"
      ],
      "notes": [
        "Listens only to active post composer input events and ignores DMs, search, native inputs, and textareas."
      ]
    }
  ],
  "cost": {
    "startup": "cheap",
    "perSurface": "cheap",
    "network": "none",
    "worker": "none",
    "domWrite": "small"
  },
  "loadTriggers": [
    "startup"
  ],
  "chrome": {
    "nativeStyle": "native",
    "supportedStyles": [
      "native"
    ],
    "notes": [
      "Tweet Composer does not render app-window chrome."
    ]
  },
  "hub": {
    "category": "social",
    "shortDescription": "Convert double dashes to em dashes while typing posts.",
    "rail": {
      "supported": false,
      "defaultPinned": false
    },
    "presets": [
      "lite",
      "balanced",
      "full"
    ],
    "dataNotes": [
      "Reads only the active X/Twitter post composer text immediately around the caret."
    ],
    "localStorageNotes": [
      "Stores only Tweet Composer enablement."
    ],
    "privacyLabels": [
      "local-only"
    ]
  },
  "privacy": {
    "permissionNotes": [],
    "dataNotes": [
      "Reads only the active X/Twitter post composer text immediately around the caret.",
      "Never posts, uploads, opens a remote service, or transmits composer text."
    ],
    "localStorageNotes": [
      "Stores only Tweet Composer enablement."
    ],
    "remoteServices": [],
    "privacyLabels": [
      "local-only"
    ],
    "consentRequired": false
  },
  "package": {
    "assets": [],
    "webAccessibleAssets": []
  },
  "review": {
    "status": "reviewed",
    "reviewedBy": "milxdy-first-party-composer-tools",
    "reviewedAt": "2026-07-30",
    "notes": [
      "Preserves the built-in composerTools ID, storage key, lifecycle, X composer scope, and cleanup behavior.",
      "The checked-in replacement policy and explicit first-party replacement acknowledgement remain mandatory."
    ]
  }
}
